50,ข้อใดจัดเป็นแนวคิดของฝ่ายอำนวยการตำรวจในการทำงานชุมชนและมวลชนสัมพันธ์มีกี่ประการ,18 ประการ,29ประการ,310ประการ,412ประการ,3
51,"แนวคิดของฝ่ายอำนวยการตำรวจในส่วนของ ""การกำหนดเป้าหมาย"" และ ""การกำหนดวัตถุประสงค์"" สิ่งใดที่ควรดำเนินการก่อน",1การกำหนดวัตถุประสงค์,2การกำหนดเป้าหมาย,3ดำเนินการอะไรก่อนหลังก็ได้,4ดำเนินการพร้อมกัน,2
52,การเลือกพื้นที่เป้าหมายในการดำเนินงานชุมชนสัมพันธ์พิจารณาจากข้อใด,1ชุมชนที่เป็นพื้นที่ที่มีปัญหาอาชญากรรมสูง,2ชุมชนที่เป็นย่านธุรกิจล่อแหลมต่อการเกิดอาชญากรรม,3ชุมชนแออัดที่มีประชาชนผู้มีรายได้น้อยรวมกันอยู่,4ถูกทุกข้อ,4
53,การเลือกพื้นที่เป้าหมายในการดำเนินงานชุมชนสัมพันธ์ ในกรณีของพื้นที่ซึ่งมีปัญหาพิเศษ หมายถึงข้อใด,1พื้นที่ที่มีปัญหาเร่งด่วน,2พื้นที่ที่มีความจำเป็นต้องดำเนินงานชุมชนสัมพันธ์,3พื้นที่ที่มีปัญหาอาชญากรรมที่กระทบกระเทือนต่อขวัญของประชาชน,4ถูกทุกข้อ,4
54,การเลือกพื้นที่เป้าหมายในการดำเนินงานชุมชนสัมพันธ์ ในกรณีของพื้นที่หมู่บ้านห่างไกล หมายถึงข้อใด,1พื้นที่ชนบท,2พื้นที่ชานเมือง,3พื้นที่ที่อยู่ห่างไกลจากสถานีตำรวจ,4ถูกทุกข้อ,4
55,งานชุมชนและมวลชนสัมพันธ์ของสำนักงานตำรวจแห่งชาติเกิดขึ้นตั้งแต่แผนกรมตำรวจแม่บทฉบับใด,1แผนกรมตำรวจแม่บท ฉบับที่ 1,2แผนกรมตำรวจแม่บท ฉบับที่ 2,3แผนกรมตำรวจแม่บท ฉบับที่ 3,4แผนกรมตำรวจแม่บท ฉบับที่ 4,1
56,การป้องกันและแก้ไขปัญหาอาชญากรรมให้ได้ผลต้องเริ่มที่ใด,1หน่วยงานภาครัฐและเอกชน,2ชุมชน,3สำนักงานตำรวจแห่งชาติ,4รัฐบาล,2
57,ตำรวจต้อง............................ เพื่อให้ประชาชนในชุมชนมีทัศนคติที่ดีต่อตำรวจ,1สร้างสัมพันธภาพที่ดีกับชุมชน,2ป้องกันอาชญากรรมร่วมกับชุมชน,3ปราบปรามอาชญากรรมร่วมกับชุมชน,4แก้ไขอาชญากรรมร่วมกับชุมชน,1
58,การดำเนินการในข้อใดที่มีวัตถุประสงค์เพื่อให้ตำรวจมีปฏิสัมพันธ์ที่ดีกับชุมชน และร่วมแก้ไขปัญหาต่างๆ ของชุมชน,1งานชุมชนสัมพันธ์,2งานมวลชนสัมพันธ์,3การบริหารกิจการบ้านเมืองที่ดี,4การตำรวจชุมชน,1
59,การดำเนินการในข้อใดที่มีวัตถุประสงค์เพื่อสนับสนุนการรักษาความมั่นคงของชาติ รักษาเอกราชของชาติและบูรณภาพของดินแดน ,1งานชุมชนสัมพันธ์,2งานมวลชนสัมพันธ์,3การบริหารกิจการบ้านเมืองที่ดี,4การตำรวจชุมชน,2
60,การดำเนินการในข้อใดที่มีวัตถุประสงค์เพื่อให้ประเทศชาติดำรงอยู่ในการปกครองระบอบประชาธิปไตยภายใต้รัฐธรรมนูญแห่งราชอาณาจักรไทย,1งานชุมชนสัมพันธ์,2งานมวลชนสัมพันธ์,3การบริหารกิจการบ้านเมืองที่ดี,4การตำรวจชุมชน,2
