1,งานมวลชนสัมพันธ์มีความแตกต่างจากงานชุมชนสัมพันธ์อย่างไร,1เป้าหมายต่างกัน,2วิธีการต่างกัน,3จุดกำเนิดต่างกัน,4ไม่มีความแตกต่างกัน,1
2,ข้อใดไม่ใช่กรอบในการดำเนินงานชุมชนและมวลชนสัมพันธ์,1รัฐธรรมนูญแห่งราชอาณาจักรไทย ฉบับปัจจุบัน,2พระราชบัญญัติตำรวจแห่งชาติ พ.ศ.2547,3พระราชบัญญัติระเบียบบริหารราชการแผ่นดิน พ.ศ.2534,4พระราชกฤษฎีกา ว่าด้วย หลักเกณฑ์และวิธีการบริหารกิจการบ้านเมืองที่ดี พ.ศ.2546,3
3,ข้อใดไม่ใช่ข้อพิจารณาตัวบุคคลที่จะทำงานชุมชนและมวลชนสัมพันธ์,1ความถนัด,2ฐานะทางสังคม,3การแต่งกาย,4บุคลิกภาพ,2
4,ข้อใดไม่ใช่หลักการสร้างมนุษยสัมพันธ์,1การสำรวจตนเอง,2ศึกษาสิ่งที่ควรรู้เกี่ยวกับบุคคลที่จะเข้าไปเกี่ยวข้องด้วย,3การแสวงหาผลประโยชน์ร่วมกัน,4การผูกมิตร,3
5,......................................หมายถึง “การทำกิจกรรมที่ภาครัฐร่วมกับชุมชนหรือประชาชน โดยให้ประชาชนมีส่วนร่วมในการแสดงความคิดเห็น...”,1งานชุมชนสัมพันธ์,2งานมวลชนสัมพันธ์,3การบริหารกิจการบ้านเมืองที่ดี,4การตำรวจชุมชน,2
6,ข้อใดจัดเป็นแนวคิดของฝ่ายอำนวยการตำรวจอันดับแรกในการทำงานชุมชนและมวลชนสัมพันธ์,1การกำหนดวัตถุประสงค์,2การกำหนดเป้าหมาย,3การกำหนดแผนปฏิบัติงาน,4การเลือกพื้นที่เป้าหมาย,2
7,ข้อใดจัดเป็นแนวคิดของฝ่ายอำนวยการตำรวจอันดับสุดท้ายในการทำงานชุมชนและมวลชนสัมพันธ์,1การประชาสัมพันธ์ให้กลุ่มเป้าหมายทราบ,2การดำเนินกิจกรรมตามแผนงาน,3การติดตามและประเมินผล,4การจัดหางบประมาณในการดำเนินการ,3
8,การประสานงานด้านชุมชนและมวลชนสัมพันธ์ในลักษณะของ “การนิเทศ” หมายถึงอะไร,1การตรวจงานเพื่อให้การแนะนำปรึกษาและปรับปรุงแก้ไขวิธีทำงาน,2การให้คำปรึกษาโดยผู้เชี่ยวชาญในงานที่อาศัยเทคนิคสูงหรือมีความสลับซับซ้อน,3การพัฒนาเจ้าหน้าที่ให้มีความรู้ความสามารถในการทำงานที่สูงขึ้น,4การจัดตั้งกรรมการจากฝ่ายต่างๆ เพื่อร่วมมือและประสานการทำงาน,1
9,...................................หมายถึง “การติดต่อสื่อสารของหน่วยงานกับกลุ่มคน องค์กร หรือผู้มีส่วนได้ส่วนเสียที่อยู่ใกล้เคียง หรือเกี่ยวข้องโดยตรงกับหน่วยงาน เพื่อสร้างความรู้จักคุ้นเคยและความเข้าใจอันดีต่อกัน โดยมุ่งหวังผลให้ผู้มีส่วนได้เสียดังกล่าวเกิดทัศนคติที่ดีกับหน่วยงาน...”,1งานชุมชนสัมพันธ์,2งานมวลชนสัมพันธ์,3การบริหารกิจการบ้านเมืองที่ดี,4การตำรวจชุมชน,1
10,...................................เป็นการดำเนินการของกลุ่มมวลชนอย่างครบวงจร เริ่มตั้งแต่การฝึกอบรม การจัดตั้ง การควบคุมและการนำการเคลื่อนไหวภายในขอบเขตอำนาจหน้าที่ของตำรวจ...,1งานชุมชนสัมพันธ์,2งานมวลชนสัมพันธ์,3การบริหารกิจการบ้านเมืองที่ดี,4การตำรวจชุมชน,2
11,.......................................เกิดจากแนวคิดที่ว่า เมื่อปัญหาเกิดจากชุมชน ดังนั้นจึงต้องให้ชุมชนเข้ามามีส่วนร่วมในการป้องกันการเกิดปัญหา,1งานชุมชนสัมพันธ์,2งานมวลชนสัมพันธ์,3การตำรวจชุมชน,4ถูกทั้งข้อ 1 และข้อ 2,4
12,"พระราชกฤษฎีกา ว่าด้วยหลักเกณฑ์และวิธีการบริหารกิจการบ้านเมืองที่ดี พ.ศ.2546 มาตรา 8 บัญญัติว่า “""ในการบริหารราชการเพื่อประโยชน์สุขของประชาชน ส่วนราชการต้องดำเนินการโดยถือว่า...........เป็นศูนย์กลางที่จะได้รับการบริการจากรัฐ...”""",1ชุมชน,2ประชาสังคม,3ประชาชน,4มวลชน,3
13,"พระราชบัญญัติตำรวจแห่งชาติ พ.ศ.2547 มาตรา 7 บัญญัติว่า ""“ให้สำนักงานตำรวจแห่งชาติส่งเสริมให้.............................มีส่วนร่วมในกิจการตำรวจเพื่อป้องกันและปราบปรามการกระทำความผิดอาญา...”""",1ชุมชนและสังคม,2ชุมชนและมวลชน,3ท้องถิ่นและชุมชน,4ท้องถิ่นและสังคม,3
14,สำนักงานตำรวจแห่งชาติเริ่มมีการปฏิบัติงานชุมชนมวลชนสัมพันธ์มาตั้งแต่เมื่อใด,1พ.ศ.2511,2พ.ศ.2521,3พ.ศ.2531,4พ.ศ.2541,3
15,ข้อใดไม่ถูกต้องเกี่ยวกับ “ตำรวจบริการ”,1เป็นตำรวจที่ไม่มีหน้าที่จับกุมผู้กระทำความผิดโดยตรง,2เป็นตำรวจที่คอยให้บริการสาธารณะ,3มีลักษณะการทำงานคล้ายๆ กับเจ้าหน้าที่มูลนิธิต่างๆ,4เป็นตำรวจที่มาจากชาวบ้านทำหน้าที่ตรวจตรา ป้องกัน และสืบสวนในเขตพื้นที่ต่างๆ ,4
16,การจัดกิจกรรมให้เยาวชนเข้าเยี่ยมสถานีตำรวจ เพื่อให้รับรู้บทบาทหน้าที่ของตำรวจ ตรงกับกิจกรรมประเภทใดมากที่สุด,1กิจกรรมให้การบริการ,2กิจกรรมเสริมสร้างความเข้าใจระหว่างประชาชนและตำรวจ,3กิจกรรมเสริมสร้างความสัมพันธ์ระหว่างประชาชนและตำรวจ,4กิจกรรมเสริมสร้างความรู้ให้แก่ชุมชน,2
17,การจัดกิจกรรมสร้างวินัยจราจรเพื่อให้ประชาชนรู้ถึงกฎจราจรและการปฏิบัติงานของตำรวจจราจร ตรงกับกิจกรรมประเภทใดมากที่สุด,1กิจกรรมให้การบริการ,2กิจกรรมเสริมสร้างความเข้าใจระหว่างประชาชนและตำรวจ,3กิจกรรมเสริมสร้างความสัมพันธ์ระหว่างประชาชนและตำรวจ,4กิจกรรมเสริมสร้างความรู้ให้แก่ชุมชน,2
18,ข้อใดไม่ใช่หลักสำคัญในการกำหนดแผนงานชุมชนสัมพันธ์,1พิจารณาถึงความเป็นไปได้,2พิจารณาถึงความชัดเจน,3พิจารณาถึงความอ่อนตัว,4พิจารณาถึงความเข้มแข็ง,4
19,กรณีที่แผนงานมีปัญหา ประชาชนไม่ความสนใจ ควรปรับแผนปฏิบัติงานใหม่ให้เหมาะสมกับสถานการณ์ปัจจุบัน ตรงกับหลักในการกำหนดแผนงานข้อใดมากที่สุด,1พิจารณาถึงความเป็นไปได้,2พิจารณาถึงความชัดเจน,3พิจารณาถึงความอ่อนตัว,4พิจารณาถึงความเข้มแข็ง,3
20,มาตราใดในรัฐธรรมนูญแห่งราชอาณาจักรไทย พ.ศ.2550 ที่กำหนดถึงเรื่องการที่รัฐต้องดำเนินการตามแนวนโยบายด้านการมีส่วนร่วมของประชาชน,1มาตรา 58,2มาตรา59,3มาตรา60,4มาตรา87,4
21,ข้อใดไม่ใช่คุณสมบัติของผู้ทำงานด้านชุมชนและมวลชนสัมพันธ์,1ยิ้มแย้ม แจ่มใส,2ตั้งใจสนทนา,3เจรจาไพเราะ,4.เจาะจงรับใช้,4
22,ข้อใดเป็นข้อพิจารณาแรกในการเลือกตัวบุคคลที่จะทำงานชุมชนและมวลชนสัมพันธ์,1ความถนัด,2ฐานะทางสังคม,3การแต่งกาย,4บุคลิกภาพ,1
23,ตำรวจในข้อใดที่ไม่เหมาะกับการดำเนินงานชุมชนและมวลชนสัมพันธ์กับกลุ่มเป้าหมายที่เป็นวัยรุ่น,1มีอายุไม่มากนัก,2มีบุคลิกภาพเคร่งขรึม,3สื่อสารและเข้าใจภาษาวัยรุ่นได้ดี,4เข้าใจจิตวิทยาวัยรุ่น,2
24,ข้อใดจัดเป็นธรรมชาติของมนุษย์,1ชอบให้คนตำหนิ เพื่อจะได้ปรับปรุงตัว,2อยากมีชื่อเสียง,3ชอบคนอารมณ์ดี,4ไม่ชอบให้ใครโต้แย้ง,1
25,ข้อใดจัดเป็นเรื่องสำคัญอันดับแรกในการผูกมิตร,1มีความจริงใจต่อกัน,2การช่วยเหลือกัน,3ความมีน้ำใจต่อกัน,4การให้เกียรติซึ่งกันและกัน,1
26,ข้อใดจัดเป็นเรื่องสำคัญที่สุดที่ทำให้สัมพันธภาพระหว่างบุคคลนั้นยืนยาวต่อไป,1มีความจริงใจต่อกัน,2การช่วยเหลือกัน,3ความมีน้ำใจต่อกัน,4การให้เกียรติซึ่งกันและกัน,4
27,ข้อใดไม่ใช่เทคนิคในการถามบุคคลอื่น,1ถามสิ่งที่เขาเด่น,2ถามสิ่งที่เขาชอบ,3ถามเกี่ยวกับสิ่งเดิมๆ,4ถามเพื่อให้เขาได้ระบายความทุกข์,3
28,การถามถึงงานอดิเรกของบุคคลอื่นจัดเป็นเทคนิคในการถามข้อใด,1ถามสิ่งที่เขาเด่น,2ถามสิ่งที่เขาชอบ,3ถามเกี่ยวกับสิ่งแปลกใหม่,4ถามเพื่อให้เขาได้ระบายความทุกข์,2
29,การพูดหรือถามเกี่ยวกับเรื่องที่เป็นข่าวน่าสนใจในปัจจุบันจัดเป็นเทคนิคในการถามข้อใด,1ถามสิ่งที่เขาเด่น,2ถามสิ่งที่เขาชอบ,3ถามเกี่ยวกับสิ่งแปลกใหม่,4ถามเพื่อให้เขาได้ระบายความทุกข์,3
30,การถามลักษณะเจาะลึกให้ทราบถึงปัญหาความเดือนร้อนหรือทุกข์ของคู่สนทนาจัดเป็นเทคนิคในการถามข้อใด,1ถามสิ่งที่เขาเด่น,2ถามสิ่งที่เขาชอบ,3ถามเกี่ยวกับสิ่งแปลกใหม่,4ถามเพื่อให้เขาได้ระบายความทุกข์,4
31,ข้อใดจัดเป็นเทคนิคในการฟัง,1เงียบ,2ผงกศีรษะ,3ออกเสียงรับ,4ถูกทุกข้อ,4
32,เมื่อฟังใครพูดก็ตาม สิ่งที่สำคัญในการฟังคือต้อง.......... เพื่อให้เขาพูดได้อย่างเต็มที่,1เงียบ,2ผงกศีรษะ,3ออกเสียงรับ,4ถูกทุกข้อ,1
33,เมื่อฟังแล้วเพื่อให้คนพูดรู้ว่าเราฟัง มีความตั้งใจก็โดยการ...........เป็นเชิงรับ,1เงียบ,2ผงกศีรษะ,3ออกเสียงรับ,4ถูกทุกข้อ,2
34,เมื่อฟังแล้ว ควร...................คำเบาๆ ว่า อืม อึ้ม หรือคนไทยก็มักใช้คำว่า อ๋อ อ้อ เป็นต้น,1เงียบ,2ผงกศีรษะ,3ออกเสียงรับ,4ถูกทุกข้อ,3
35,"เมื่อฟัง นอกจากเงียบ ผงกศีรษะรับ หรือออกเสียงรับปกติแล้ว บางครั้งอาจต้อง............ด้วยคำว่า ""ใช่"" ""ครับ (ค่ะ)"" เพื่อเป็นการยืนยันความตั้งใจในการฟัง",1ตอบรับ,2แสดงความรู้สึกประกอบ,3ออกเสียงรับ,4ถูกทุกข้อ,1
36,เมื่อเขาพูดเรื่องเศร้า ก็ควรทำหน้าเศร้า เมื่อเขาพูดเรื่องสนุกสนาน ก็ควรหัวเราะยิ้มแย้ม แต่ควรระวังอย่า.............................เกินไปกว่าเรื่องที่เขากำลังพูด,1ตอบรับ,2แสดงความรู้สึกประกอบ,3ออกเสียงรับ,4ถูกทุกข้อ,2
37,ข้ดใดจัดเป็นวิธีการในการทวนคำพูด ,1ทวนทุกคำ,2ทวนทุกคำแต่เปลี่ยนสรรพนาม,3ทวนเฉพาะคำสำคัญๆ ท้ายประโยค,4ถูกทุกข้อ,4
38,การทวนคำพูดในข้อใดที่มักใช้กับกรณีจิตแพทย์กับคนไข้,1ทวนทุกคำ,2ทวนทุกคำแต่เปลี่ยนสรรพนาม,3ทวนเฉพาะคำสำคัญๆ ท้ายประโยค,4ถูกทุกข้อ,1
39,"การทวนคำพูดที่ผู้พูดพูดว่า ""ผมกำลังมีทุกข์"" ผู้ฟังก็ว่า ""คุณกำลังมีทุกข์หรือ"" จัดเป็นการทวนคำพูดในข้อใด",1ทวนทุกคำ,2ทวนทุกคำแต่เปลี่ยนสรรพนาม,3ทวนเฉพาะคำสำคัญๆ ท้ายประโยค,4ถูกทุกข้อ,2
40,การทวนคำพูดในข้อใดที่มีการใช้มากที่สุด,1ทวนทุกคำ,2ทวนทุกคำแต่เปลี่ยนสรรพนาม,3ทวนเฉพาะคำสำคัญๆ ท้ายประโยค,4ถูกทุกข้อ,3
41,การทวนคำพูดในข้อใดที่เป็นประโยชน์ เหมาะสมมากที่สุด,1ทวนทุกคำ,2ทวนทุกคำแต่เปลี่ยนสรรพนาม,3ทวนเฉพาะคำสำคัญๆ ท้ายประโยค,4ถูกทุกข้อ,3
42,"ข้อใดจัดเป็นแนวคิดของฝ่ายอำนวยการตำรวจก่อนที่จะ ""กำหนดแผนปฏิบัติงาน"" ในการทำงานชุมชนและมวลชนสัมพันธ์",1การประชาสัมพันธ์ให้กลุ่มเป้าหมายทราบ,2การดำเนินกิจกรรมตามแผนงาน,3การติดตามและประเมินผล,4การแสวงหาบุคลากรที่เหมาะสม,4
43,"ข้อใดจัดเป็นแนวคิดของฝ่ายอำนวยการตำรวจก่อนที่จะ ""แสวงหาข้อมูลของกลุ่มเป้าหมาย"" ในการทำงานชุมชนและมวลชนสัมพันธ์",1การประชาสัมพันธ์ให้กลุ่มเป้าหมายทราบ,2การดำเนินกิจกรรมตามแผนงาน,3การติดตามและประเมินผล,4การแสวงหาบุคลากรที่เหมาะสม,4
44,"ข้อใดจัดเป็นแนวคิดของฝ่ายอำนวยการตำรวจก่อนที่จะ ""แสวงหาบุคลากรที่เหมาะสม"" ในการทำงานชุมชนและมวลชนสัมพันธ์",1การประชาสัมพันธ์ให้กลุ่มเป้าหมายทราบ,2การดำเนินกิจกรรมตามแผนงาน,3การติดตามและประเมินผล,4การกำหนดเป้าหมาย,4
45,"ข้อใดจัดเป็นแนวคิดของฝ่ายอำนวยการตำรวจก่อนที่จะ ""จัดหางบประมาณในการดำเนินการ"" ในการทำงานชุมชนและมวลชนสัมพันธ์",1การประชาสัมพันธ์ให้กลุ่มเป้าหมายทราบ,2การดำเนินกิจกรรมตามแผนงาน,3การกำหนดแผนปฏิบัติงาน,4การติดตามและประเมินผล,3
46,"ข้อใดจัดเป็นแนวคิดของฝ่ายอำนวยการตำรวจภายหลัง ""การดำเนินกิจกรรมตามแผนงาน"" ในการทำงานชุมชนและมวลชนสัมพันธ์",1การประชาสัมพันธ์ให้กลุ่มเป้าหมายทราบ,2การกำหนดแผนปฏิบัติงาน,3การจัดหางบประมาณในการดำเนินการ,4การติดตามและประเมินผล,4
47,"ข้อใดจัดเป็นแนวคิดของฝ่ายอำนวยการตำรวจภายหลัง ""การจัดหางบประมาณในการดำเนินการ"" ในการทำงานชุมชนและมวลชนสัมพันธ์",1การประชาสัมพันธ์ให้กลุ่มเป้าหมายทราบ,2การกำหนดวัตถุประสงค์,3การกำหนดกลุ่มเป้าหมาย,4การเลือกพื้นที่เป้าหมาย,1
48,"ข้อใดจัดเป็นแนวคิดของฝ่ายอำนวยการตำรวจภายหลัง ""การประชาสัมพันธ์ให้กลุ่มเป้าหมายทราบ"" ในการทำงานชุมชนและมวลชนสัมพันธ์",1การดำเนินกิจกรรมตามแผนงาน,2การกำหนดแผนปฏับัติงาน,3การแสวงหาข้อมูลของกลุ่มเป้าหมาย,4การแสวงหาบุคลากรที่เหมาะสม,1
49,"ข้อใดจัดเป็นแนวคิดของฝ่ายอำนวยการตำรวจภายหลัง ""การแสวงหาบุคลากรที่เหมาะสม"" ในการทำงานชุมชนและมวลชนสัมพันธ์",1การกำหนดกลุ่มเป้าหมาย,2การกำหนดวัตถุประสงค์,3การประชาสัมพันธ์ให้กลุ่มเป้าหมายทราบ,4การกำหนดเป้าหมาย,3
