46,ข่าวกรองที่นำมาใช้ในการปฏิบัติการทางอากาศ มีอะไรบ้าง,1ข่าวกรองภาพถ่ายทางอากาศ,2ข่าวกรองเป้าหมายทางอากาศ,3ข่าวกรองทำเนียบกำลังรบทางอากาศ,4ถูกทุกข้อ,4
47,ข่าวที่มีคุณค่าต่อการปฏิบัติงาน คือข้อใด,1ข่าวในเรื่องฝ่ายตรงเราและลมฟ้าอากาศ,2ข่าวในเรื่องฝ่ายตรงข้ามและภูมิประเทศ,3ข่าวในเรื่องฝ่ายตรงข้าม ลมฟ้าอากาศ และภูมิประเทศ,4ข่าวในเรื่องฝ่ายเรา,3
48,วัตถุประสงค์ของการใช้ข่าวมีไว้เพื่อสิ่งใด,1เพื่อขจัดความไม่แน่นอนในเรื่องที่เกี่ยวกับฝ่ายเราให้เหลือน้อยที่สุด,2เพื่อขจัดความไม่แน่นอนในเรื่องที่เกี่ยวกับภูมิประเทศให้เหลือน้อยที่สุด,3เพื่อขจัดความไม่แน่นอนในเรื่องที่เกี่ยวกับฝ่ายตรงข้าม และภูมิประเทศให้เหลือน้อยที่สุด,4เพื่อขจัดความไม่แน่นอนในเรื่องที่เกี่ยวกับ ฝ่ายตรงข้าม ลมฟ้าอากาศและภูมิประเทศให้เหลือน้อยที่สุด,4
49,ความสำคัญของข่าวคืออะไร,1ถ้าฝ่ายเราสามารถทราบเรื่องราวและรายละเอียดของฝ่ายตรงข้ามมากเพียงใด ฝ่ายตรงข้ามก็ย่อมจะรู้เรื่องของฝ่ายเราน้อยลงไปเท่านั้น,2ถ้าฝ่ายเราสามารถทราบเรื่องราวและรายละเอียดของฝ่ายตรงข้ามมากเพียงใด ฝ่ายตรงข้ามก็ย่อมจะรู้เรื่องของฝ่ายเรามากขึ้นเท่านั้น,3ถ้าฝ่ายเราสามารถทราบเรื่องราวและรายละเอียดของฝ่ายตรงข้ามน้อยเพียงใด ฝ่ายตรงข้ามก็ย่อมจะรู้เรื่องของฝ่ายเราน้อยลงไปเท่านั้น,4ข้อ 2 และ 3 ถูกต้อง,1
50,การที่ฝ่ายเราไม่ได้ข่าวอย่างเพียงพอก็เท่ากับว่าเราจะเข้าทำการรบได้อย่างไร ,1เข้าทำการรบโดยเสี่ยงเอาเผื่อว่าจะชนะ,2เข้าทำการรบได้แต่ชนะได้ไม่ยาก,3เข้าทำการรบโดยมองเห็นชัยชนะอย่างยากที่สุด,4ถูกทุกข้อ,3
51,แหล่งข่าวพอที่จะเพ่งเล็งและถือประโยชน์ได้มีอะไรบ้าง,1การปฏิบัติของฝ่ายตรงข้ามหรือการงดเว้นไม่ปฏิบัติของฝ่ายตรงข้าม,2เจ้าหน้าที่ของฝ่ายตรงข้าม,3การปฏิบัติของฝ่ายตรงข้ามหรือการงดเว้นไม่ปฏิบัติของฝ่ายเรา และเจ้าหน้าที่ของฝ่ายตรงข้าม,4การปฏิบัติของฝ่ายตรงข้ามหรือการงดเว้นไม่ปฏิบัติของฝ่ายตรงข้าม และเจ้าหน้าที่ของฝ่ายตรงข้าม,4
52,การป้องกันและการต่อต้านข่าว คืออะไร,1 การปฏิบัติการต่างๆ เพื่อกีดกันหรือขัดขวางมิให้ฝ่ายเราได้ข่าวเกี่ยวกับฝ่ายเรา,2 การปฏิบัติการต่างๆ เพื่อกีดกันหรือขัดขวางมิให้ฝ่ายตรงข้ามได้ข่าวเกี่ยวกับฝ่ายตรงข้าม,3 การปฏิบัติการต่างๆ เพื่อกีดกันหรือขัดขวางมิให้ฝ่ายเราได้ข่าวเกี่ยวกับฝ่ายตรงข้าม,4 การปฏิบัติการต่างๆ เพื่อกีดกันหรือขัดขวางมิให้ฝ่ายตรงข้ามได้ข่าวเกี่ยวกับฝ่ายเรา,4
53,"""...เป็นสิ่งสำคัญยิ่งต่อการปฏิบัติการทางยุทธวิธีทางการข่าว"" จงเติมคำในช่องว่าง",1การรักษาความลับ,2การเปิดเผยความจริง,3การปกปิดความจริง,4การรักษาความจริง,1
54,การใช้ การพรางและการซ่อนพราง เพื่อประโยชน์อะไร,1เป็นการทำให้ฝ่ายตรงข้ามยุ่งยากในสิ่งที่เราเอาไปซ่อน,2เป็นการป้องกันมิให้ฝ่ายเราเห็นการปฏิบัติการต่าง ๆ ของฝ่ายตรงข้าม,3เป็นการป้องกันและต่อต้านมิให้ฝ่ายตรงข้ามเห็นการปฏิบัติการต่าง ๆ ของฝ่ายเรา,4เป็นการป้องกันมิให้ฝ่ายตรงข้ามเห็นการปฏิบัติการต่าง ๆ ของฝ่ายตรงข้าม,3
55,การรักษาความปลอดภัยทางการติดต่อสื่อสาร จะต้องพยายามอย่างไร,1ใส่รหัสลับหลายๆชั้น,2ส่งข้อมูลตามเวลาทุกวัน,3รายงานแบบครบถ้วนผ่านวิทยุสื่อสาร,4ระมัดระวังให้มีการปฏิบัติตามระเบียบการใช้เครื่องมือสื่อสารอย่างถูกต้อง,4
56,การตรวจข่าว จะต้องปฏิบัติตามระเบียบการตรวจข่าวอย่างเคร่งครัดอย่างไร,1ให้รักษารหัสลับไว้,2อย่าใช้รหัสที่คิดขึ้นเอง,3ใช้รหัสที่คิดเองได้,4ข้อ 1 และ 3 ถูกต้อง,2
57,การปฏิบัติการในเวลากลางคืน ผู้บังคับบัญชาชั้นเหนือตามลำดับชั้นมักจะกำหนดสิ่งใด,1มักจะกำหนดระเบียบเวลาการระงับไฟฟ้า,2มักจะกำหนดระเบียบการใช้แสงไฟ,3มักจะให้เปิดไฟให้ทั่ว,4ถูกทุกข้อ,2
58,ระบบการใช้สัญญาณผ่านจะต้องกระทำเช่นไร,1 การใช้สัญญาณผ่านจะมีการนัดหมายไว้ล่วงหน้าและเปลี่ยนทุกวัน,2 การใช้สัญญาณผ่านจะมีการนัดหมายไว้ล่วงหน้าและเปลี่ยนทุกผลัด,3การใช้สัญญาณผ่านจะมีประกาศเป็นเอกสารล่วงหน้าและเปลี่ยนทุกวัน,4การใช้สัญญาณผ่านจะมีประกาศเป็นเอกสารล่วงหน้าและเปลี่ยนทุกผลัด,1
59,กองบัญชาการใด มีอำนาจหน้าที่ที่กระทำการเกี่ยวกับข่าวสารฝ่ายตำรวจ ,1กองบัญชาการตำรวจนครบาล,2กองบัญชาการตำรวจตรวจคนเข้าเมือง,3กองบัญชาการตำรวจสอบสวนกลาง,4กองบัญชาการตำรวจสันติบาล,4
60,"หลักการรายงานข่าว ต้องทำอย่างไร
",1จะต้องรอให้ครบถ้วนสมบูรณ์ทุกครั้งจึงจะรายงาน,2จะต้องรายงานข่าวทุกชนิดด้วยความรวดเร็วสมบูรณ์และถูกพอประมาณ,3จะต้องรายงานข่าวทุกชนิดด้วยความรวดเร็วสมบูรณ์และถูกต้องที่สุดเท่าที่จะสามารถกระทำได้,4ต้องรายงานโดยเร็วทุกรายละเอียดทั้งเท็จและจริง,3
