46,ขั้นตอนพื้นฐานลำดับแรกในกระบวนการประเมินผลขององค์กรคืออะไร,1การเลือกหาเหตุผลในการประเมิน,2การกำหนดวัตถุประสงค์ในการประเมิน,3การหามาตรการในการวัดผล,4การรวบรวมข้อมูลเพื่อการประเมินผล,1
47,ขั้นตอนพื้นฐานลำดับสุดท้ายในกระบวนการประเมินผลขององค์กรคืออะไร,1การรวบรวมข้อมูลเพื่อการประเมินผล,2การวิเคราะห์ข้อมูลที่รวบรวมได้,3การรายงานผลหรือข้อสรุปที่ได้,4การนำผลที่ได้ไปประยุกต์ใช้,4
48,การพิจารณาว่าอะไรคือปรัชญาในการประเมินผล จัดอยู่ในขั้นตอนพื้นฐานในกระบวนการประเมินผลขององค์กรข้อใด,1การเลือกหาเหตุผลในการประเมิน,2การกำหนดวัตถุประสงค์ในการประเมิน,3การหามาตรการในการวัดผล,4การรวบรวมข้อมูลเพื่อการประเมินผล,1
49,การพิจารณาว่าแบบประเมินผลขององค์กรอาศัยแบบจำลองอย่างไร จัดอยู่ในขั้นตอนพื้นฐานในกระบวนการประเมินผลขององค์กรข้อใด,1การเลือกหาเหตุผลในการประเมิน,2การกำหนดวัตถุประสงค์ในการประเมิน,3การหามาตรการในการวัดผล,4การรวบรวมข้อมูลเพื่อการประเมินผล,1
50,การพิจารณาว่าแบบประเมินผลขององค์กรดำเนินการโดยบุคคลภายนอกหรือไม่ จัดอยู่ในขั้นตอนพื้นฐานในกระบวนการประเมินผลขององค์กรข้อใด,1การเลือกหาเหตุผลในการประเมิน,2การกำหนดวัตถุประสงค์ในการประเมิน,3การหามาตรการในการวัดผล,4การรวบรวมข้อมูลเพื่อการประเมินผล,1
51,การสังเกตเพื่อการประเมินผล จัดอยู่ในขั้นตอนพื้นฐานในกระบวนการประเมินผลขององค์กรข้อใด,1การเลือกหาเหตุผลในการประเมิน,2การกำหนดวัตถุประสงค์ในการประเมิน,3การหามาตรการในการวัดผล,4การรวบรวมข้อมูลเพื่อการประเมินผล,4
52,การใช้แบบสอบถามเพื่อการประเมินผล จัดอยู่ในขั้นตอนพื้นฐานในกระบวนการประเมินผลขององค์กรข้อใด,1การเลือกหาเหตุผลในการประเมิน,2การกำหนดวัตถุประสงค์ในการประเมิน,3การหามาตรการในการวัดผล,4การรวบรวมข้อมูลเพื่อการประเมินผล,4
53,การใช้รายงานประจำเดือนเพื่อการประเมินผล จัดอยู่ในขั้นตอนพื้นฐานในกระบวนการประเมินผลขององค์กรข้อใด,1การเลือกหาเหตุผลในการประเมิน,2การกำหนดวัตถุประสงค์ในการประเมิน,3การหามาตรการในการวัดผล,4การรวบรวมข้อมูลเพื่อการประเมินผล,4
54,การสัมภาษณ์เพื่อการประเมินผล จัดอยู่ในขั้นตอนพื้นฐานในกระบวนการประเมินผลขององค์กรข้อใด,1การเลือกหาเหตุผลในการประเมิน,2การกำหนดวัตถุประสงค์ในการประเมิน,3การหามาตรการในการวัดผล,4การรวบรวมข้อมูลเพื่อการประเมินผล,4
55,การดำเนินงานประชาสัมพันธ์ของทุกองค์กร ต้องยึดถือเอา..........................เป็นพื้นฐาน,1ประชามติ,2ความคิดเห็นของประชาชน,3ความต้องการของประชาชน,4ถูกทุกข้อ,4
56,การสำรวจวิจัยประชามติจากกลุ่มประชาชนวิธีใดที่มีแนวโน้มที่จะทำให้ได้ข้อมูลที่ใกล้เคียงความเป็นจริงมากที่สุด,1ใช้การสัมภาษณ์,2ใช้แบบสอบถาม,3ใช้แบบทดสอบ,4ถูกทุกข้อ,2
57,การนำเอาทัศนคติและปฏิกิริยาที่รวบรวมมาได้มาพิจารณาประกอบการวางแผน กำหนดนโยบายและโครงการขององค์กร เกี่ยวข้องกับกระบวนการและขั้นตอนในการดำเนินการประชาสัมพันธ์ลักษณะใดมากที่สุด,1การวิจัยและรับฟังความคิดเห็น,2การวางแผนและการตัดสินใจ,3การติดต่อสื่อสาร,4การประเมินผล,2
58,การวัดผลว่าการดำเนินงานประชาสัมพันธ์ที่ได้ทำไปแล้วนั้น ได้ผลตามวัตถุประสงค์ที่ได้วางแผนไว้หรือไม่ เกี่ยวข้องกับกระบวนการและขั้นตอนในการดำเนินการประชาสัมพันธ์ลักษณะใดมากที่สุด,1การวิจัยและรับฟังความคิดเห็น,2การวางแผนและการตัดสินใจ,3การติดต่อสื่อสาร,4การประเมินผล,4
59,การปฏิบัติการสื่อสารกับกลุ่มประชาชนที่เกี่ยวข้อง โดยการดำเนินงานตามแผนหรือโครงการที่กำหนดไว้ เกี่ยวข้องกับกระบวนการและขั้นตอนในการดำเนินการประชาสัมพันธ์ลักษณะใดมากที่สุด,1การวิจัยและรับฟังความคิดเห็น,2การวางแผนและการตัดสินใจ,3การติดต่อสื่อสาร,4การประเมินผล,3
60,การค้นคว้าหาข้อเท็จจริง ข้อมูลต่างๆ ที่ได้มาจากการวิจัยและรับฟังความคิดเห็น เกี่ยวข้องกับกระบวนการและขั้นตอนในการดำเนินการประชาสัมพันธ์ลักษณะใดมากที่สุด,1การวิจัยและรับฟังความคิดเห็น,2การวางแผนและการตัดสินใจ,3การติดต่อสื่อสาร,4การประเมินผล,1
