51,ข้อใดคือระบบสนับสนุนสำนักงาน,1โปรแกรมการทำงานแบบระบบเครือข่าย,2ระบบการประมวลภาพ,3การทำสำเนา,4หน่วยเก็บข้อมูลถาวร,1,,
52,วัตถุประสงค์ของระบบสารสนเทศสำนักงาน คือ,1เพื่อให้การติดต่อสื่อสารระหว่างพนักงานในองค์กรเดียวกันเป็นไปอย่างสะดวก,2เพื่อให้การติดต่อสื่อสารระหว่างองค์กรเป็นไปอย่างสะดวก,2เพื่อให้การติดต่อกับสิ่งแวดล้อมภายนอกเป็นไปอย่างสะดวก,4ถูกทุกข้อ,4,,
53,OIS คือ ,1ระบบสารสนเทศสำหรับผู้บริหาร,2ระบบสารสนเทศสำนักงาน,3ระบบสารสนเทศเพื่อการบริหาร,4ระบบสารสนเทศเพื่อการตัดสินใจ,2,,
54,Decision Supporting System คือ,1ระบบจัดการรายงาน,2ระบบการจัดเอกสาร,3ระบบสนับสนุนการตัดสินใจ,4ระบบประมวลผลรายงาน,3,,
55,ระบบสนับสนุนการตัดสินใจ จัดเตรียมข้อมูลให้กับผู้ใด,1ผู้บริหาร,2พนักงาน,3ลูกค้า,4เหมาะกับทุกกลุ่ม,1,,
56,Management Report System คือ,1ระบบจัดการรายงาน,2ระบบประมวลผลรายการ,3ระบบรายงานตามคำขอ,4ระบบสนับสนุนการตัดสินใจ,1,,
57,ระบบจัดการรายงาน เรียกอีกอย่างว่า,1แบบตัวอย่าง,2แบบกำหนดไว้ล่วงหน้า,3แบบแก้ปัญหา,4แบบฟอรม์,2,,
58,ระบบการจัดการรายงานมักจะใช้ในการแก้ปัญหาใด,1ปัญหาแบบไม่เป็นโครงสร้าง,2ปัญหาแบบมีโครงสร้าง,3ปัญหาแบบกึ่งโครงสร้าง,4ปัญหาซับซ้อน,2,,
59,ระบบสนับสนุนการตัดสินใจมักใช้กับการตัดสินใจประเภทใด,1การตัดสินใจแบบไม่เป็นโครงสร้าง,2การตัดสินใจแบบกึ่งโครงสร้าง,3การตัดสินใจแบบไม่เคยกำหนดล่วงหน้ามาก่อน,4ถูกทุกข้อ,4,,
60,การตัดสินใจแบบไม่เป็นโครงสร้าง เป็นการตัดสินใจสำหรับปัญหาที่มีลักษณะอย่างไร,1ปัญหาซึ่งมีรูปแบบไม่ชัดเจน,2ปัญหาที่มีความซับซ้อน,3ปัญหาที่ไม่มีแนวทางแก้ไขที่ชัดเจน,4ถูกทุกข้อ,4,,
