50,การประชาสัมพันธ์ในภาวะวิกฤติ ควรหลีกเลี่ยงการซักถาม การลงข่าวที่กระทบต่อองค์กร ท่านเห็นด้วยหรือไม่ เพราะเหตุใด,1ไม่เห็นด้วย ควรให้ความร่วมมือและอธิบายให้เกิดความเข้าใจและถูกต้อง ,2ไม่เห็นด้วย ควรรีบปฏิเสธการรับผิดหากเห็นว่าไม่ใช่ฝ่ายผิด,4เห็นด้วย เพื่อโต้แย้ง ถกเถียง ในข้อความจริงที่ปรากฏตามสื่อ,4เห็นด้วย เพื่อเป็นการประชาสัมพันธ์ในทันที,1
51,การที่มีประชาชนมาสมัครสอบเข้าเป็นตำรวจเป็นจำนวนมาก ในการรับสมัครแต่ละครั้ง จัดเป็นภาพลักษณ์ประเภทใด,1ภาพลักษณ์ขององค์กร,2ภาพลักษณ์ของสถาบัน,3ภาพลักษณ์ของสินค้า,4ภาพลักษณ์ที่มีต่อตราสินค้า,2
52,ภาพที่เกิดขึ้นในใจของประชาชน ที่ไม่ชอบ หรือ เกลียดชังตำรวจ จัดเป็นภาพลักษณ์ประเภทใด,1ภาพลักษณ์ขององค์กร,2ภาพลักษณ์ของสถาบัน,3ภาพลักษณ์ของสินค้าหรือบริการ,4ภาพลักษณ์ที่มีต่อตราสินค้า,3
53,ภาพที่ประชาชนเชื่อมั่นในหัวหน้าสถานีตำรวจ ในการให้บริการที่ดี จัดเป็นภาพลักษณ์ประเภทใด,1ภาพลักษณ์ขององค์กร,2ภาพลักษณ์ของสถาบัน,3ภาพลักษณ์ของสินค้าหรือบริการ,4ภาพลักษณ์ที่มีต่อตราสินค้า,4
54,การที่องค์กรดำเนินกิจกรรมที่มีความรับผิดชอบต่อสังคม (CSR) เป็นการสร้างภาพลักษณ์ ในลักษณะใด,1 ภาพลักษณ์ที่เกิดโดยธรรมชาติ ,2ภาพลักษณ์ที่เกิดจากการปรุงแต่ง,3ภาพลักษณ์ที่เกิดจากการประเมิน,4ภาพลักษณ์ที่สร้างสรรค์ได้,2
55,ภาพลักษณ์ที่ต้องการให้องค์กรมีความก้าวหน้า ทันสมัย เป็นการสร้างภาพลักษณ์ ในลักษณะใด,1 ภาพลักษณ์ที่เกิดโดยธรรมชาติ ,2ภาพลักษณ์ที่เกิดจากการปรุงแต่ง,3ภาพลักษณ์ที่เกิดจากการประเมิน,4ภาพลักษณ์ที่สร้างสรรค์ได้,2
56,การที่มีข่าวว่าข้าราชการตำรวจ เรียก รับ สินบทจากประชาชน เป็นภาพลักษณ์ ในลักษณะใด,1 ภาพลักษณ์ที่เกิดโดยธรรมชาติ ,2ภาพลักษณ์ที่เกิดจากการปรุงแต่ง,3ภาพลักษณ์ที่เกิดจากการประเมิน,4ภาพลักษณ์ที่สร้างสรรค์ได้,1
57,การที่องค์กรตำรวจ มีลักษณะการดำเนินงาน ที่เสี่ยงต่อการถูกโจมตี เพราะการให้บริการสาธารณะ ซึ่งอาจเกิดความผิดพลาดได้ เป็นภาพลักษณ์ ในลักษณะใด,1 ภาพลักษณ์ที่เกิดโดยธรรมชาติ ,2ภาพลักษณ์ที่เกิดจากการปรุงแต่ง,3ภาพลักษณ์ที่เกิดจากการประเมิน,4ภาพลักษณ์ที่สร้างสรรค์ได้,1
58,การสร้างทัศนคติที่ดีต่อองค์กร ข้อใดสำคัญที่สุด,1ป้องกันและแก้ไขความเข้าใจผิดได้,2สนับสนุนนโยบายและการดำเนินงานขององค์กรได้,3เกิดภาพลักษณ์ที่ดีต่อองค์กร,4สร้างสัมพันธ์อันดีกับประชาชนได้,3
59,งานประชาสัมพันธ์สามารถช่วยให้การดำเนินงานต่างๆ ขององค์กรประสบความสำเร็จได้  ท่านเห็นด้วยกับคำกล่าวนี้ หรือไม่ อย่างไร,1เห็นด้วย หากมีวิธีการที่จะสร้างภาพลักษณ์ที่ดีในสายตาประชาชนกลุ่มเป้าหมายอย่างเหมาะสม,2เห็นด้วยแต่องค์กรต้องประชาสัมพันธ์ในเรื่องที่ประชาชนสนใจและเป็นบวกต่อองค์กร,3ไม่เห็นด้วยการประชาสัมพันธ์ทำให้การทำงานของตำรวจยุ่งยากมากขึ้น,4ไม่เห็นด้วยเนื่องจากเป็นหลักการที่ใช้กับภาคเอกชนในส่วนของรัฐหลักการนี้ไม่น่าจะถูกต้อง,1
60,ข้อใดที่สามารถทำให้ภาพลักษณ์องค์กรดำรงอยู่ในจิตใจของกลุ่มเป้าหมายได้ในระยะยาว,1ผู้บริหารระดับสูงที่ประชาชนเชื่อมั่น ศรัทธา,2การประชาสัมพันธ์ที่ดี ต่อเนื่องและสม่ำเสมอ,3พนักงานหรือบุคคลกรที่ดีขององค์กร,5การบริหารจัดการองค์กร,2