32,บุคคลที่มีความมุ่งมั่นทำงานให้เกิดความเจริญก้าวหน้าในการทำงานที่ตนรับผิดชอบ แสดงว่าเขามีสิ่งใด,มีการเปลี่ยนแปลงรูปแบบการทำงาน,มีความพยายาม มานะ อดทน,จรรยาบรรณในการทำงาน,มีพลังกระตือรือร้น,3
33,ข้อใดไม่ใช่กระบวนการจูงใจ,เลือกแนวทางที่สนองความต้องการ,ตั้งเป้าหมายความสำเร็จ,รับรู้ความต้องการ,กระทำพฤติกรรมไปสู่เป้าหมาย,2
34,ระดับการตื่นตัวระดับใดที่นักจิตวิทยาเชื่อว่าทำให้บุคคลพร้อมที่จะเคลื่อนไหวที่จะแสดงพฤติกรรมในการทำงานดีที่สุด,การตื่นตัวระดับต่ำ,การตื่นตัวระดับกลาง,การตื่นตัวระดับสูง,การตื่นตัวระดับสูงสุด,2
35,การชักจูงให้คนมาทำงานอย่างสม่ำเสมอ โดยการยกย่องหรือประกาศเกียรติคุณผู้ปฏิบัติงานที่ไม่มาสายหรือขาดงานให้ปรากฎ เป็นการสร้างแรงจูงใจโดยอาศัยสิ่งใด,ความต้องการ,ความคาดหวัง,แรงขับ,สิ่งล่อใจ,4
36,อาการใจสั่น ตาลอย หงุดหงิด อารมณ์เสีย ถือเป็นสภาพทางจิตวิทยาเกิดจากอะไร,การตื่นตัว,แรงขับ,การคาดหวัง,สิ่งล่อใจ,2
37,ข้อสรุปการศึกษาการตื่นตัวของ Donald O.Hebb คือ,การตื่นตัวขึ้นอยู่กับระบบประสาทอัตโนมัติ,บุคลิกภาพมีความสัมพันธ์กับการตื่นตัว,การตื่นตัวกับอารมณ์มีความสัมพันธ์กัน,ลักษณะการตื่นตัวสอดคล้องกับลักษณะนิสัย,3
38,ผู้บริหารควรปฏิบัติอย่างไรกับลูกน้องหากสิ่งที่คาดหวังกับสิ่งที่เกิดขึ้นจริงห่างกันมาก,ต้องสื่อสารสร้างความเข้าใจกับลูกน้อง,แนะนำให้ลูกน้องทำใจ,ให้งานลูกน้องทำเพิ่มมากขึ้น,ไม่ต้องพูดอะไรปล่อยให้เป็นธรรมชาติ,1
39,หากท่านต้องการความสำเร็จของงานโดยใช้ความคาดหวังเป็นแรงกระตุ้น ท่านจะทำอย่างไรจึงเหมาะสม,ให้ลูกน้องทำงานโดยวางแผนและเป้าหมาย,ตั้งระดับของผลงานตามที่ควรจะเป็น,พิจารณาผลตอบแทนที่ใกล้เคียงกับสิ่งที่คาดหวัง,ถูกทุกข้อ,4
40,แรงขับให้บุคคลพยายามที่จะประกอบพฤติกรรมประสบผลตามมาตรฐานความเป็นเลิศ หมายถึงอะไร,แรงจูงใจใฝ่สัมพันธ์,แรงจูงใจใฝ่สัมฤทธิ์,แรงจูงใจใฝ่อำนาจ,แรงจูงใจใฝ่พึ่งพา,2
41,บุคคลที่มาจากครอบครัวอบอุ่น พี่น้องมีความสามัคคีรักใคร่ โอบอ้อมอารี เห็นใจผู้อื่น มักจะมีแรงจูงใจในข้อใด,แรงจูงใจใฝ่สัมพันธ์,แรงจูงใจใฝ่สัมฤทธิ์,แรงจูงใจใฝ่อำนาจ,แรงจูงใจใฝ่พึ่งพา,1
42,ลักษณะของบุคคลที่มีแรงจูงใจใฝ่สัมพันธ์สูง ยกเว้นข้อใด,ไม่ทะเยอทะยาน,ไม่กล้าแสดงออก,สภาพอ่อนแอ,ตั้งเป้าหมายต่ำ,3
43,ลักษณะของบุคคลที่มีแรงจูงใจใฝ่อำนาจคือ,เห็นด้วยกับคนส่วนใหญ่,อ่อนโยน,ชอบเป็นผู้นำ,ไม่ชอบเสี่ยง,3
44,ผู้ที่ถือความคิดเห็นหรือความสำคัญของตนเป็นใหญ่ แสดงว่าเขามีแรงจูงใจแบบใด,แรงจูงใจใฝ่สัมพันธ์,แรงจูงใจใฝ่ก้าวร้าว,แรงจูงใจใฝ่อำนาจ,แรงจูงใจใฝ่พึ่งพา,2
45,ไม่มั่นใจในตนเอง ไม่กล้าตัดสินใจในเรื่องต่างๆ ด้วยตนเอง แสดงว่าพ่อแม่เลี้ยงดูลูกแบบใด,แรงจูงใจใฝ่สัมพันธ์,แรงจูงใจใฝ่ก้าวร้าว,แรงจูงใจใฝ่อำนาจ,แรงจูงใจใฝ่พึ่งพา,4
46,การจูงใจในการทำงานตามแนวคิดเฟรดเดอริก เทย์เลอร์ เชื่อว่า,ปริมาณงานและคุณภาพโดยจ่ายผลตอบแทนเป็นเงิน,การทำงานล่วงเวลาจูงใจทำให้คนทำงานและผลผลิตมากขึ้น,ปริมาณงานและคุณภาพโดยลดจำนวนชั่วโมงการทำงาน,เวลาการพักผ่อนนานขึ้นทำให้งานมีคุณภาพมากขึ้น,1
47,ทฤษฎีลำดับความต้องการของมาสโลว์ขั้นใดอยู่ในอุดมคติเข้าถึงได้ยาก,ความต้องการความมั่นคงปลอดภัย,ความต้องการสังคมและความรัก,ความต้องการยอมรับในคุณค่าตนเอง,ความต้องการความสำเร็จในชีวิต,4
48,ทฤษฎีสองปัจจัยประกอบด้วย,ปัจจัยพื้นฐาน กับปัจจัยสภาพแวดล้อม,ปัจจัยมูลเหตุจูงใจ กับปัจจัยพลานามัย,ปัจจัยมูลเหตุจูงใจ กับปัจจัยอนามัย,ปัจจัยภายใน กับปัจจัยสภาพแวดล้อม,3
49,"การน้อมนำแนวทางพระราชทาน ""เข้าใจ เข้าถึง และพัฒนา"" รัฐบาลนำมาใช้ในเรื่องใด",การจัดการปัญหาจราจรในพื้นที่กรุงเทพมหานคร,ความสามารถในการให้บริการประชาชนของข้าราชการ,ใช้เป็นเครื่องมือสื่อสารของรัฐเพื่อประโยชน์สาธารณะ,การส่งเสริมปรับปรุงสภาพแวดล้อม,2
50,"""การดำเนินชีวิตโดยใช้วิชาการอย่างเดียวยังไม่เพียงพอ จะต้องอาศัยความรู้รอบตัวและหลักศีลธรรมประกอบด้วย ผู้ที่มีความรู้ดีแต่ขาดความยั้งคิด นำความรู้ไปใช้ในทางมิชอบ ก็เท่ากับเป็นบุคคลที่เป็นภัยแก่สังคมของมนุษย์"" ข้อสรุปใดถูกต้อง",ความรู้เป็นพื้นฐานสำคัญของการดำเนินชีวิต,ความยั้งคิดจะช่วยให้เกิดความรอบคอบในการดำเนินชีวิต,ควรดำเนินชีวิตอย่างไม่ประมาท,หลักศีลธรรมจะเป็นเกราะการดำเนินชีวิต,3
51,"ขาดทุนคือกำไร หมายความว่า ""ถ้าเราทำอะไรที่เป็นการกระทำแล้ว เราก็เสียแต่ในที่สุดที่เราเสียมันเป็นการได้ การเสียคือการได้ ประเทศชาติก็จะก้าวหน้าและการที่คนอยู่ดีมีสุขนั้น เป็นการนับที่เป็นมูลค่าเงินมิได้"" จากพระราชดำรัสทรงให้ยึดถือหลักการใด",การให้และการเสียสละ,ความเมตตากรุณา,ความเพียรพยายาม,การลงทุนไม่แสวงหากำไร,1
52,ผู้บริหารควรใช้อะไรในการจูงใจลูกน้องเกิดความพึงพอใจในการทำงานหรือมีความสุขจากการทำงาน,ความสำเร็จของงาน,การยอมรับนับถือจากคนอื่น,ความรับผิดชอบหน้าที่เหมาะสมกับตำแหน่ง,โอกาสก้าวหน้าในหน้าที่การงาน,4
53,ข้อใดไม่ใช่หลักการพื้นฐานของจรรยาบรรณ,หลักความเสมอภาค,หลักความเคารพ,หลักความยุติธรรม,หลักประโยชน์เกื้อกูล,1
54,พระบรมราโชวาทในพิธีสวนสนามในโอกาสที่โรงเรียนนายร้อยตำรวจสถาปนาครบ 100 ปี ผู้ที่สามารถปฏิบัติหน้าที่ของตำรวจให้สำเร็จได้ครบถ้วน จะต้องเป็นบุคคลที่มีคุณสมบัติอย่างไร,มีความรู้ความสามารถจริง มีระเบียบวินัย มีความเข้มแข็ง อดทนและมีสติยั้งคิดสูง,มีความรู้ความสามารถ มีความเข้มแข็ง อดทน และมีความเสียสละ,ต้องใช้ความรู้ความสามารถและความอดทน เสียสละเป็นอย่างสูง,ต้องยึดม่นในหลักการและเหตุผล ความถูกต้องเป็นธรรม,2
55,"""นายตำรวจถือว่าเป็นข้าราชการพลเรือน แต่ที่ได้รับกระบี่ก็เพราะมีหน้าที่รับผิดชอบกว้างขวางมาก ทางราชการจึงมอบอาวุธหรืออำนาจให้ควบคู่ไปกับหน้าที่สำหรับเป็นเครื่องมือปฏิบัติงาน ทุกคนจึงควรระมัดระวังใช้อำนาจที่มีอยู่ให้ถูกตรงตามหน้าที่"" การใช้อำนาจของตำรวจให้ถูกตรงหน้าที่อย่างไร",ให้กฎหมายเป็นเครื่องมือในการรักษาความสงบสุข,ไม่ใช้อำนาจในการแสวงหาผลประโยชน์เบียดบังประชาชน,ใช้อำนาจรักษาความสงบสุข ปกป้องสุจริตชน ผดุงความถูกต้องเป็นธรรม,ถูกทุกข้อ,3
56,ผู้ที่เป็นตำรวจควรต้องทราบตระหนักถึงความรับผิดชอบในหน้าที่และสิทธิของตนดังกล่าวแล้ว ตั้งใจพยายามฝึกฝนตนเองให้มีความรู้ความสามารถจริง มีระเบียบวินัย มีความเข้มแข็ง อดทน และสติยั้งคิดสูง เพื่อใช้อำนาจที่มีอยู่ด้วยความเที่ยงตรง ด้วยความฉลาดรอบคอบ และด้วยความสังวรระวัง มิให้เกินขอบเขตและความจำเป็น การมีสติยั้งคิดสูง หมายความว่าอย่างไร,ความคิดวินิจฉัยที่ถ่องแท้เที่ยงตรง,รักษาอุดมคติให้มั่นคงเหนียวแน่น,ความยั้งคิดและความสุขุมรอบคอบ ไม่กระทำการใดๆ โดยประมาทพลั้งเผลอ,ระมัดระวังตั้งตัวตั้งใจอยู่ในความเป็นกลางอย่างเคร่งครัด,3
57,ตำรวจต้องระมัดระวังตั้งใจปฏิบัติหน้าที่ให้ถูกตรงและได้ผลตามเป้าหมาย คือให้กฎหมายเป็นเครื่องมือในการรักษาความสงบสุข และเป็นการผดุงความถูกต้องเป็นธรรมเสมอ แต่การจะทำหน้าที่ให้ได้ผลสมบูรณ์ ดังนั้นทุกคนจะต้องตั้งตนตั้งใจให้หนักแน่นมั่นคงอยู่ใน…….เป็นเบื้องต้นก่อน,ความสุจริตยุติธรรม,ศีลในธรรม,คุณธรรมความดี,ความถูกต้องเที่ยงตรง,1
58,สารัตถะของพระบรมราโชวาทที่พระราชทานแก่คณะบุคคลในวโรกาสต่างๆ คืออะไร,กระบวนการบริหารองค์การ,ภารกิจหน้าที่ที่บุคลการควรประพฤติ,แนวทางการปฏิบัติงานที่สอดคล้องกับสภาพบ้านเมือง,ถูกทุกข้อ,4
59,สิ่งที่เป็นเครื่องเหนี่ยวรั้งให้ข้าราชการตำรวจอยู่ในกรอบของศีลธรรมและคุณธรรม อีกทั้งเป็นแนวทางชี้นำให้ข้าราชการตำรวจบรรลุถึงปณิธานของการเป็นผู้พิทักษ์สันติราษฎร์ หมายถึงข้อใด,จริยธรรมของตำรวจ,จรรยาบรรณของตำรวจ,คุณธรรม ค่านิยมหลัก และอุดมคติตำรวจ,ถูกทุกข้อ,3
60,งานตำรวจนั้นเกี่ยวข้องกับประชาชนอย่างใกล้ชิด ต้องอาศัยความร่วมมือสนับสนุนจากประชาชนอย่างมาก ด้วยเหตุนี้ตำรวจจึงต้องทำตัวให้เป็นที่ศรัทธาเชื่อถือของประชาชน วิธีการทำให้ประชาชนเชื่อถือศรัทธาอย่างไร,ต้องประพฤติปฏิบัติให้ดีอยู่ในศีลธรรม,ปฏิบัติงานในหน้าที่ให้ถูกต้อง เที่ยงตรง ด้วยความสุภาพและเป็นมิตร,ช่วยเหลือเกื้อกูลประชาชนได้ต้องถือเป็นภาระต้องกระทำทันทีในทุกโอกาส,ถูกทุกข้อ,4
